### ISSUE TITLE
Parameter type inference for Parse

### ISSUE THREAD

**Issue by sunng87** [sunng87/pgwire#52]
Some clients like rust-postgres uses type inference for parameters in `Parse` message:

```
Frame 467: 146 bytes on wire (1168 bits), 146 bytes captured (1168 bits) on interface lo, id 0
Ethernet II, Src: 00:00:00_00:00:00 (00:00:00:00:00:00), Dst: 00:00:00_00:00:00 (00:00:00:00:00:00)
Internet Protocol Version 6, Src: ::1, Dst: ::1
Transmission Control Protocol, Src Port: 55388, Dst Port: 5432, Seq: 62, Ack: 792, Len: 60
PostgreSQL
    Type: Parse
    Length: 45
    Statement: s0
    Query: SELECT * FROM mytable WHERE id = $1
    Parameters: 0
PostgreSQL
    Type: Describe
    Length: 8
    Statement: s0
PostgreSQL
    Type: Sync
    Length: 4
```

It sends zero parameters in `Parse` and expect a `ParameterDescription` for parameter type inference.

```
Frame 468: 204 bytes on wire (1632 bits), 204 bytes captured (1632 bits) on interface lo, id 0
Ethernet II, Src: 00:00:00_00:00:00 (00:00:00:00:00:00), Dst: 00:00:00_00:00:00 (00:00:00:00:00:00)
Internet Protocol Version 6, Src: ::1, Dst: ::1
Transmission Control Protocol, Src Port: 5432, Dst Port: 55388, Seq: 792, Ack: 122, Len: 118
PostgreSQL
    Type: Parse completion
    Length: 4
PostgreSQL
    Type: Parameter description
    Length: 10
    Parameters: 1
        Type OID: 20
PostgreSQL
    Type: Row description
    Length: 95
    Field count: 4
        Column name: id
            Table OID: 16389
            Column index: 1
            Type OID: 20
            Column length: 8
            Type modifier: -1
            Format: Text (0)
        Column name: name
            Table OID: 16389
            Column index: 2
            Type OID: 1043
            Column length: -1
            Type modifier: -1
            Format: Text (0)
        Column name: value
            Table OID: 16389
            Column index: 3
            Type OID: 23
            Column length: 4
            Type modifier: -1
            Format: Text (0)
        Column name: ts
            Table OID: 16389
            Column index: 4
            Type OID: 1114
            Column length: 8
            Type modifier: -1
            Format: Text (0)
PostgreSQL
    Type: Ready for query
    Length: 5
    Status: Idle (73)
```

### Changes we need:

- update our `do_describe` API in `ExtendedQueryHandler` for parameter type inference
