### ISSUE TITLE
Full support for describe statement

### ISSUE THREAD

**Issue by sunng87** [sunng87/pgwire#47]
In addition to row description, a `parameter description` message is also returned when describing a statement. 

Request:
```
Frame 26: 129 bytes on wire (1032 bits), 129 bytes captured (1032 bits) on interface lo, id 0
Ethernet II, Src: 00:00:00_00:00:00 (00:00:00:00:00:00), Dst: 00:00:00_00:00:00 (00:00:00:00:00:00)
Internet Protocol Version 4, Src: 127.0.0.1, Dst: 127.0.0.1
Transmission Control Protocol, Src Port: 50390, Dst Port: 5432, Seq: 62, Ack: 391, Len: 63
    Source Port: 50390
    Destination Port: 5432
    [Stream index: 5]
    [Conversation completeness: Complete, WITH_DATA (31)]
    [TCP Segment Len: 63]
    Sequence Number: 62    (relative sequence number)
    Sequence Number (raw): 2111721206
    [Next Sequence Number: 125    (relative sequence number)]
    Acknowledgment Number: 391    (relative ack number)
    Acknowledgment number (raw): 3826299601
    1000 .... = Header Length: 32 bytes (8)
    Flags: 0x018 (PSH, ACK)
    Window: 512
    [Calculated window size: 65536]
    [Window size scaling factor: 128]
    Checksum: 0xfe67 [unverified]
    [Checksum Status: Unverified]
    Urgent Pointer: 0
    Options: (12 bytes), No-Operation (NOP), No-Operation (NOP), Timestamps
    [Timestamps]
    [SEQ/ACK analysis]
    TCP payload (63 bytes)
    [PDU Size: 49]
    [PDU Size: 9]
    [PDU Size: 5]
PostgreSQL
    Type: Parse
    Length: 48
    Statement: s0
    Query: SELECT * FROM mytest WHERE id = $1
    Parameters: 1
        Type OID: 23
PostgreSQL
    Type: Describe
    Length: 8
    Statement: s0
PostgreSQL
    Type: Sync
    Length: 4
```

Response:
```
Frame 27: 160 bytes on wire (1280 bits), 160 bytes captured (1280 bits) on interface lo, id 0
Ethernet II, Src: 00:00:00_00:00:00 (00:00:00:00:00:00), Dst: 00:00:00_00:00:00 (00:00:00:00:00:00)
Internet Protocol Version 4, Src: 127.0.0.1, Dst: 127.0.0.1
Transmission Control Protocol, Src Port: 5432, Dst Port: 50390, Seq: 391, Ack: 125, Len: 94
    Source Port: 5432
    Destination Port: 50390
    [Stream index: 5]
    [Conversation completeness: Complete, WITH_DATA (31)]
    [TCP Segment Len: 94]
    Sequence Number: 391    (relative sequence number)
    Sequence Number (raw): 3826299601
    [Next Sequence Number: 485    (relative sequence number)]
    Acknowledgment Number: 125    (relative ack number)
    Acknowledgment number (raw): 2111721269
    1000 .... = Header Length: 32 bytes (8)
    Flags: 0x018 (PSH, ACK)
    Window: 512
    [Calculated window size: 65536]
    [Window size scaling factor: 128]
    Checksum: 0xfe86 [unverified]
    [Checksum Status: Unverified]
    Urgent Pointer: 0
    Options: (12 bytes), No-Operation (NOP), No-Operation (NOP), Timestamps
    [Timestamps]
    [SEQ/ACK analysis]
    TCP payload (94 bytes)
    [PDU Size: 5]
    [PDU Size: 11]
    [PDU Size: 72]
    [PDU Size: 6]
PostgreSQL
    Type: Parse completion
    Length: 4
PostgreSQL
    Type: Parameter description
    Length: 10
    Parameters: 1
        Type OID: 23
PostgreSQL
    Type: Row description
    Length: 71
    Field count: 3
        Column name: id
            Table OID: 16389
            Column index: 1
            Type OID: 23
            Column length: 4
            Type modifier: -1
            Format: Text (0)
        Column name: name
            Table OID: 16389
            Column index: 2
            Type OID: 1043
            Column length: -1
            Type modifier: -1
            Format: Text (0)
        Column name: ts
            Table OID: 16389
            Column index: 3
            Type OID: 1114
            Column length: 8
            Type modifier: -1
            Format: Text (0)
PostgreSQL
    Type: Ready for query
    Length: 5
    Status: Idle (73)
```

**Comment by sunng87** [comment]
implemented in #48
